"No.","Time","Source","Destination","Protocol","Length","Info"
"529","4.807615982","206.123.170.175","128.135.24.73","TCP","74","41816  >  443 [SYN] Seq=0 Win=64240 Len=0 MSS=1460 SACK_PERM TSval=278075566 TSecr=0 WS=128"
"533","4.867856583","128.135.24.73","206.123.170.175","TCP","66","443  >  41816 [SYN, ACK] Seq=0 Ack=1 Win=64240 Len=0 MSS=1460 SACK_PERM WS=128"
"534","4.867912104","206.123.170.175","128.135.24.73","TCP","54","41816  >  443 [ACK] Seq=1 Ack=1 Win=64256 Len=0"
"535","4.868578426","206.123.170.175","128.135.24.73","TLSv1.2","1783","Client Hello"
"537","4.929575484","128.135.24.73","206.123.170.175","TCP","60","443  >  41816 [ACK] Seq=1 Ack=1730 Win=63616 Len=0"
"538","4.931607484","128.135.24.73","206.123.170.175","TLSv1.2","2421","Server Hello, Certificate, Server Key Exchange, Server Hello Done"
"539","4.931641165","206.123.170.175","128.135.24.73","TCP","54","41816  >  443 [ACK] Seq=1730 Ack=2368 Win=63488 Len=0"
"542","4.936903844","206.123.170.175","128.135.24.73","TLSv1.2","147","Client Key Exchange, Change Cipher Spec, Encrypted Handshake Message"
"543","4.937104962","206.123.170.175","128.135.24.73","TLSv1.2","153","Application Data"
"544","4.937292478","206.123.170.175","128.135.24.73","TLSv1.2","1087","Application Data"
"550","4.996814897","128.135.24.73","206.123.170.175","TCP","60","443  >  41816 [ACK] Seq=2368 Ack=1922 Win=64128 Len=0"
"551","4.997658744","128.135.24.73","206.123.170.175","TLSv1.2","328","New Session Ticket, Change Cipher Spec, Encrypted Handshake Message"
"552","4.997659171","128.135.24.73","206.123.170.175","TLSv1.2","223","Application Data"
"553","4.997659243","128.135.24.73","206.123.170.175","TLSv1.2","270","Application Data"
"554","4.997869023","206.123.170.175","128.135.24.73","TCP","54","41816  >  443 [ACK] Seq=2955 Ack=3027 Win=64128 Len=0"
"555","4.998413832","206.123.170.175","128.135.24.73","TLSv1.2","92","Application Data"
"566","5.101228622","128.135.24.73","206.123.170.175","TCP","60","443  >  41816 [ACK] Seq=3027 Ack=2993 Win=64128 Len=0"
"573","5.146412653","206.123.170.175","128.135.24.73","TLSv1.2","128","Application Data"
"580","5.206076377","128.135.24.73","206.123.170.175","TCP","60","443  >  41816 [ACK] Seq=3027 Ack=3067 Win=64128 Len=0"
"625","5.731481003","128.135.24.73","206.123.170.175","TCP","2974","443  >  41816 [PSH, ACK] Seq=3027 Ack=3067 Win=64128 Len=2920 [TCP segment of a reassembled PDU]"
"626","5.731481321","128.135.24.73","206.123.170.175","TCP","2974","443  >  41816 [PSH, ACK] Seq=5947 Ack=3067 Win=64128 Len=2920 [TCP segment of a reassembled PDU]"
"627","5.731481374","128.135.24.73","206.123.170.175","TCP","2974","443  >  41816 [PSH, ACK] Seq=8867 Ack=3067 Win=64128 Len=2920 [TCP segment of a reassembled PDU]"
"628","5.731481429","128.135.24.73","206.123.170.175","TCP","2974","443  >  41816 [PSH, ACK] Seq=11787 Ack=3067 Win=64128 Len=2920 [TCP segment of a reassembled PDU]"
"629","5.731545470","128.135.24.73","206.123.170.175","TCP","2974","443  >  41816 [PSH, ACK] Seq=14707 Ack=3067 Win=64128 Len=2920 [TCP segment of a reassembled PDU]"
"630","5.731737258","206.123.170.175","128.135.24.73","TCP","54","41816  >  443 [ACK] Seq=3067 Ack=17627 Win=64128 Len=0"
"633","5.791251342","128.135.24.73","206.123.170.175","TLSv1.2","2974","[TCP Previous segment not captured] , Ignored Unknown Record"
"634","5.791251759","128.135.24.73","206.123.170.175","TCP","2974","[TCP Out-Of-Order] 443  >  41816 [PSH, ACK] Seq=17627 Ack=3067 Win=64128 Len=2920"
"635","5.791251810","128.135.24.73","206.123.170.175","TLSv1.2","2974","Ignored Unknown Record"
"636","5.791251863","128.135.24.73","206.123.170.175","TLSv1.2","1514","Ignored Unknown Record"
"637","5.791299915","206.123.170.175","128.135.24.73","TCP","66","[TCP Dup ACK 630#1] 41816  >  443 [ACK] Seq=3067 Ack=17627 Win=64128 Len=0 SLE=20547 SRE=23467"
"638","5.791319428","206.123.170.175","128.135.24.73","TCP","54","41816  >  443 [ACK] Seq=3067 Ack=23467 Win=61568 Len=0"
"639","5.791405708","128.135.24.73","206.123.170.175","TLSv1.2","1514","Ignored Unknown Record"
"640","5.791405777","128.135.24.73","206.123.170.175","TLSv1.2","2974","Ignored Unknown Record"
"641","5.791405831","128.135.24.73","206.123.170.175","TLSv1.2","2974","Ignored Unknown Record"
"642","5.791405883","128.135.24.73","206.123.170.175","TLSv1.2","610","Ignored Unknown Record"
"643","5.791412092","206.123.170.175","128.135.24.73","TCP","54","41816  >  443 [ACK] Seq=3067 Ack=27847 Win=64128 Len=0"
"644","5.791802240","206.123.170.175","128.135.24.73","TCP","54","41816  >  443 [ACK] Seq=3067 Ack=35703 Win=64128 Len=0"
"656","5.914236410","206.123.170.175","128.135.24.73","TLSv1.2","233","Application Data"
"657","5.916404368","206.123.170.175","128.135.24.73","TLSv1.2","163","Application Data"
"663","5.923957201","206.123.170.175","128.135.24.73","TLSv1.2","160","Application Data"
"664","5.924044568","206.123.170.175","128.135.24.73","TLSv1.2","267","Application Data, Application Data"
"665","5.924072423","206.123.170.175","128.135.24.73","TLSv1.2","169","Application Data"
"666","5.924117902","206.123.170.175","128.135.24.73","TLSv1.2","302","Application Data, Application Data"
"667","5.924296260","206.123.170.175","128.135.24.73","TLSv1.2","371","Application Data, Application Data, Application Data"
"669","5.924506649","206.123.170.175","128.135.24.73","TLSv1.2","328","Application Data, Application Data"
"698","5.973653503","128.135.24.73","206.123.170.175","TCP","60","443  >  41816 [ACK] Seq=35703 Ack=3246 Win=64128 Len=0"
"699","5.974045976","128.135.24.73","206.123.170.175","TLSv1.2","315","Application Data"
"700","5.976319602","128.135.24.73","206.123.170.175","TLSv1.2","282","Application Data"
"701","5.978738920","206.123.170.175","128.135.24.73","TCP","54","41816  >  443 [ACK] Seq=4628 Ack=36192 Win=64128 Len=0"
"702","5.983404192","128.135.24.73","206.123.170.175","TCP","60","443  >  41816 [ACK] Seq=36192 Ack=4037 Win=64128 Len=0"
"703","5.983702693","128.135.24.73","206.123.170.175","TLSv1.2","646","Application Data"
"704","5.984993234","128.135.24.73","206.123.170.175","TCP","1514","443  >  41816 [ACK] Seq=36784 Ack=4628 Win=64128 Len=1460 [TCP segment of a reassembled PDU]"
"705","5.985014816","206.123.170.175","128.135.24.73","TCP","54","41816  >  443 [ACK] Seq=4628 Ack=38244 Win=64128 Len=0"
"706","5.985064695","128.135.24.73","206.123.170.175","TCP","1514","443  >  41816 [PSH, ACK] Seq=38244 Ack=4628 Win=64128 Len=1460 [TCP segment of a reassembled PDU]"
"707","5.985064765","128.135.24.73","206.123.170.175","TCP","2974","443  >  41816 [PSH, ACK] Seq=39704 Ack=4628 Win=64128 Len=2920 [TCP segment of a reassembled PDU]"
"708","5.985064835","128.135.24.73","206.123.170.175","TCP","1514","443  >  41816 [ACK] Seq=42624 Ack=4628 Win=64128 Len=1460 [TCP segment of a reassembled PDU]"
"709","5.985112823","128.135.24.73","206.123.170.175","TCP","1514","443  >  41816 [PSH, ACK] Seq=44084 Ack=4628 Win=64128 Len=1460 [TCP segment of a reassembled PDU]"
"710","5.985112883","128.135.24.73","206.123.170.175","TCP","2974","443  >  41816 [PSH, ACK] Seq=45544 Ack=4628 Win=64128 Len=2920 [TCP segment of a reassembled PDU]"
"711","5.985112925","128.135.24.73","206.123.170.175","TLSv1.2","844","Application Data"
"712","5.985349921","206.123.170.175","128.135.24.73","TCP","54","41816  >  443 [ACK] Seq=4628 Ack=49254 Win=64128 Len=0"
"713","5.986271962","128.135.24.73","206.123.170.175","TCP","1514","443  >  41816 [ACK] Seq=49254 Ack=4628 Win=64128 Len=1460 [TCP segment of a reassembled PDU]"
"714","5.986376390","128.135.24.73","206.123.170.175","TCP","1514","443  >  41816 [PSH, ACK] Seq=50714 Ack=4628 Win=64128 Len=1460 [TCP segment of a reassembled PDU]"
"715","5.986376459","128.135.24.73","206.123.170.175","TCP","2974","443  >  41816 [PSH, ACK] Seq=52174 Ack=4628 Win=64128 Len=2920 [TCP segment of a reassembled PDU]"
"716","5.986376547","128.135.24.73","206.123.170.175","TCP","2974","443  >  41816 [PSH, ACK] Seq=55094 Ack=4628 Win=64128 Len=2920 [TCP segment of a reassembled PDU]"
"717","5.986376593","128.135.24.73","206.123.170.175","TCP","2974","443  >  41816 [PSH, ACK] Seq=58014 Ack=4628 Win=64128 Len=2920 [TCP segment of a reassembled PDU]"
"718","5.986376643","128.135.24.73","206.123.170.175","TCP","2974","443  >  41816 [PSH, ACK] Seq=60934 Ack=4628 Win=64128 Len=2920 [TCP segment of a reassembled PDU]"
"719","5.986394185","206.123.170.175","128.135.24.73","TCP","54","41816  >  443 [ACK] Seq=4628 Ack=52174 Win=64128 Len=0"
"720","5.986415457","128.135.24.73","206.123.170.175","TLSv1.2","1867","Application Data"
"721","5.986447664","128.135.24.73","206.123.170.175","TCP","2974","443  >  41816 [PSH, ACK] Seq=65667 Ack=4628 Win=64128 Len=2920 [TCP segment of a reassembled PDU]"
"722","5.986447706","128.135.24.73","206.123.170.175","TCP","1514","443  >  41816 [ACK] Seq=68587 Ack=4628 Win=64128 Len=1460 [TCP segment of a reassembled PDU]"
"723","5.986824512","128.135.24.73","206.123.170.175","TCP","1514","443  >  41816 [PSH, ACK] Seq=70047 Ack=4628 Win=64128 Len=1460 [TCP segment of a reassembled PDU]"
"724","5.986824553","128.135.24.73","206.123.170.175","TLSv1.2","1347","Application Data"
"725","5.987356728","206.123.170.175","128.135.24.73","TCP","54","41816  >  443 [ACK] Seq=4628 Ack=72800 Win=64128 Len=0"
"726","5.991565527","128.135.24.73","206.123.170.175","TCP","1514","443  >  41816 [ACK] Seq=72800 Ack=4628 Win=64128 Len=1460 [TCP segment of a reassembled PDU]"
"727","5.991661914","128.135.24.73","206.123.170.175","TCP","1514","443  >  41816 [PSH, ACK] Seq=74260 Ack=4628 Win=64128 Len=1460 [TCP segment of a reassembled PDU]"
"728","5.991673549","206.123.170.175","128.135.24.73","TCP","54","41816  >  443 [ACK] Seq=4628 Ack=75720 Win=70016 Len=0"
"732","6.038147952","128.135.24.73","206.123.170.175","TCP","2974","443  >  41816 [PSH, ACK] Seq=75720 Ack=4628 Win=64128 Len=2920 [TCP segment of a reassembled PDU]"
"733","6.038147984","128.135.24.73","206.123.170.175","TCP","2974","443  >  41816 [PSH, ACK] Seq=78640 Ack=4628 Win=64128 Len=2920 [TCP segment of a reassembled PDU]"
"734","6.038160218","206.123.170.175","128.135.24.73","TCP","54","41816  >  443 [ACK] Seq=4628 Ack=78640 Win=75776 Len=0"
"735","6.038163854","206.123.170.175","128.135.24.73","TCP","54","41816  >  443 [ACK] Seq=4628 Ack=81560 Win=81664 Len=0"
"737","6.044322313","128.135.24.73","206.123.170.175","TCP","2974","443  >  41816 [PSH, ACK] Seq=81560 Ack=4628 Win=64128 Len=2920 [TCP segment of a reassembled PDU]"
"738","6.044322410","128.135.24.73","206.123.170.175","TCP","2974","443  >  41816 [PSH, ACK] Seq=84480 Ack=4628 Win=64128 Len=2920 [TCP segment of a reassembled PDU]"
"739","6.044356775","206.123.170.175","128.135.24.73","TCP","54","41816  >  443 [ACK] Seq=4628 Ack=84480 Win=87552 Len=0"
"740","6.044361931","206.123.170.175","128.135.24.73","TCP","54","41816  >  443 [ACK] Seq=4628 Ack=87400 Win=93312 Len=0"
"741","6.044751805","128.135.24.73","206.123.170.175","TLSv1.2","2974","Application Data"
"742","6.044751831","128.135.24.73","206.123.170.175","TCP","2974","443  >  41816 [PSH, ACK] Seq=90320 Ack=4628 Win=64128 Len=2920 [TCP segment of a reassembled PDU]"
"743","6.044760382","206.123.170.175","128.135.24.73","TCP","54","41816  >  443 [ACK] Seq=4628 Ack=90320 Win=99200 Len=0"
"744","6.044765833","206.123.170.175","128.135.24.73","TCP","54","41816  >  443 [ACK] Seq=4628 Ack=93240 Win=104960 Len=0"
"745","6.044811730","128.135.24.73","206.123.170.175","TCP","2974","443  >  41816 [PSH, ACK] Seq=93240 Ack=4628 Win=64128 Len=2920 [TCP segment of a reassembled PDU]"
"746","6.044811765","128.135.24.73","206.123.170.175","TLSv1.2","1514","Application Data"
"747","6.044818484","206.123.170.175","128.135.24.73","TCP","54","41816  >  443 [ACK] Seq=4628 Ack=96160 Win=110848 Len=0"
"748","6.044907052","128.135.24.73","206.123.170.175","TCP","1514","443  >  41816 [PSH, ACK] Seq=97620 Ack=4628 Win=64128 Len=1460 [TCP segment of a reassembled PDU]"
"749","6.044907079","128.135.24.73","206.123.170.175","TCP","2974","443  >  41816 [PSH, ACK] Seq=99080 Ack=4628 Win=64128 Len=2920 [TCP segment of a reassembled PDU]"
"750","6.044907114","128.135.24.73","206.123.170.175","TCP","2974","443  >  41816 [PSH, ACK] Seq=102000 Ack=4628 Win=64128 Len=2920 [TCP segment of a reassembled PDU]"
"751","6.044907150","128.135.24.73","206.123.170.175","TCP","1514","443  >  41816 [ACK] Seq=104920 Ack=4628 Win=64128 Len=1460 [TCP segment of a reassembled PDU]"
"752","6.044918483","206.123.170.175","128.135.24.73","TCP","54","41816  >  443 [ACK] Seq=4628 Ack=99080 Win=116736 Len=0"
"753","6.044921907","206.123.170.175","128.135.24.73","TCP","54","41816  >  443 [ACK] Seq=4628 Ack=102000 Win=122496 Len=0"
"754","6.044925087","206.123.170.175","128.135.24.73","TCP","54","41816  >  443 [ACK] Seq=4628 Ack=104920 Win=128384 Len=0"
"755","6.044963866","128.135.24.73","206.123.170.175","TCP","1514","443  >  41816 [PSH, ACK] Seq=106380 Ack=4628 Win=64128 Len=1460 [TCP segment of a reassembled PDU]"
"756","6.044963895","128.135.24.73","206.123.170.175","TLSv1.2","2974","Application Data"
"757","6.044970163","206.123.170.175","128.135.24.73","TCP","54","41816  >  443 [ACK] Seq=4628 Ack=107840 Win=134272 Len=0"
"758","6.044973761","206.123.170.175","128.135.24.73","TCP","54","41816  >  443 [ACK] Seq=4628 Ack=110760 Win=140032 Len=0"
"760","6.045697478","128.135.24.73","206.123.170.175","TCP","2974","443  >  41816 [PSH, ACK] Seq=110760 Ack=4628 Win=64128 Len=2920 [TCP segment of a reassembled PDU]"
"761","6.045708747","206.123.170.175","128.135.24.73","TCP","54","41816  >  443 [ACK] Seq=4628 Ack=113680 Win=145920 Len=0"
"762","6.046715000","128.135.24.73","206.123.170.175","TLSv1.2","2974","Application Data"
"763","6.046715232","128.135.24.73","206.123.170.175","TCP","2974","443  >  41816 [PSH, ACK] Seq=116600 Ack=4628 Win=64128 Len=2920 [TCP segment of a reassembled PDU]"
"764","6.046715290","128.135.24.73","206.123.170.175","TCP","1514","443  >  41816 [ACK] Seq=119520 Ack=4628 Win=64128 Len=1460 [TCP segment of a reassembled PDU]"
"765","6.046730624","206.123.170.175","128.135.24.73","TCP","54","41816  >  443 [ACK] Seq=4628 Ack=116600 Win=151680 Len=0"
"766","6.046736161","206.123.170.175","128.135.24.73","TCP","54","41816  >  443 [ACK] Seq=4628 Ack=119520 Win=157568 Len=0"
"767","6.046765235","128.135.24.73","206.123.170.175","TCP","1514","443  >  41816 [PSH, ACK] Seq=120980 Ack=4628 Win=64128 Len=1460 [TCP segment of a reassembled PDU]"
"768","6.046765270","128.135.24.73","206.123.170.175","TCP","2974","443  >  41816 [PSH, ACK] Seq=122440 Ack=4628 Win=64128 Len=2920 [TCP segment of a reassembled PDU]"
"769","6.046765307","128.135.24.73","206.123.170.175","TCP","1514","443  >  41816 [ACK] Seq=125360 Ack=4628 Win=64128 Len=1460 [TCP segment of a reassembled PDU]"
"770","6.046772203","206.123.170.175","128.135.24.73","TCP","54","41816  >  443 [ACK] Seq=4628 Ack=122440 Win=163456 Len=0"
"771","6.046776757","206.123.170.175","128.135.24.73","TCP","54","41816  >  443 [ACK] Seq=4628 Ack=125360 Win=169216 Len=0"
"772","6.046858224","128.135.24.73","206.123.170.175","TCP","1514","443  >  41816 [PSH, ACK] Seq=126820 Ack=4628 Win=64128 Len=1460 [TCP segment of a reassembled PDU]"
"773","6.046858257","128.135.24.73","206.123.170.175","TLSv1.2","2974","Application Data"
"774","6.046858313","128.135.24.73","206.123.170.175","TCP","2974","443  >  41816 [PSH, ACK] Seq=131200 Ack=4628 Win=64128 Len=2920 [TCP segment of a reassembled PDU]"
"775","6.046867035","206.123.170.175","128.135.24.73","TCP","54","41816  >  443 [ACK] Seq=4628 Ack=128280 Win=175104 Len=0"
"776","6.046871167","206.123.170.175","128.135.24.73","TCP","54","41816  >  443 [ACK] Seq=4628 Ack=131200 Win=180992 Len=0"
"777","6.046876276","206.123.170.175","128.135.24.73","TCP","54","41816  >  443 [ACK] Seq=4628 Ack=134120 Win=186752 Len=0"
"778","6.047890171","128.135.24.73","206.123.170.175","TCP","2862","443  >  41816 [PSH, ACK] Seq=134120 Ack=4628 Win=64128 Len=2808 [TCP segment of a reassembled PDU]"
"779","6.047903516","206.123.170.175","128.135.24.73","TCP","54","41816  >  443 [ACK] Seq=4628 Ack=136928 Win=192384 Len=0"
"781","6.050983583","128.135.24.73","206.123.170.175","TCP","2974","443  >  41816 [PSH, ACK] Seq=136928 Ack=4628 Win=64128 Len=2920 [TCP segment of a reassembled PDU]"
"782","6.051028540","206.123.170.175","128.135.24.73","TCP","54","41816  >  443 [ACK] Seq=4628 Ack=139848 Win=198272 Len=0"
"783","6.051042187","128.135.24.73","206.123.170.175","TCP","2974","443  >  41816 [PSH, ACK] Seq=139848 Ack=4628 Win=64128 Len=2920 [TCP segment of a reassembled PDU]"
"784","6.051049702","206.123.170.175","128.135.24.73","TCP","54","41816  >  443 [ACK] Seq=4628 Ack=142768 Win=204032 Len=0"
"785","6.051169675","128.135.24.73","206.123.170.175","TCP","2974","443  >  41816 [PSH, ACK] Seq=142768 Ack=4628 Win=64128 Len=2920 [TCP segment of a reassembled PDU]"
"786","6.051176664","206.123.170.175","128.135.24.73","TCP","54","41816  >  443 [ACK] Seq=4628 Ack=145688 Win=209920 Len=0"
"787","6.058894792","206.123.170.175","128.135.24.73","TLSv1.2","183","Application Data"
"789","6.097600717","128.135.24.73","206.123.170.175","TCP","166","443  >  41816 [ACK] Seq=145688 Ack=4628 Win=64128 Len=112 [TCP segment of a reassembled PDU]"
"790","6.097601286","128.135.24.73","206.123.170.175","TLSv1.2","2974","Application Data"
"791","6.097601336","128.135.24.73","206.123.170.175","TCP","2974","443  >  41816 [PSH, ACK] Seq=148720 Ack=4628 Win=64128 Len=2920 [TCP segment of a reassembled PDU]"
"792","6.097601385","128.135.24.73","206.123.170.175","TCP","2974","443  >  41816 [PSH, ACK] Seq=151640 Ack=4628 Win=64128 Len=2920 [TCP segment of a reassembled PDU]"
"793","6.097601433","128.135.24.73","206.123.170.175","TCP","2974","443  >  41816 [PSH, ACK] Seq=154560 Ack=4628 Win=64128 Len=2920 [TCP segment of a reassembled PDU]"
"794","6.097719223","206.123.170.175","128.135.24.73","TCP","54","41816  >  443 [ACK] Seq=4757 Ack=148720 Win=215808 Len=0"
"795","6.097735975","206.123.170.175","128.135.24.73","TCP","54","41816  >  443 [ACK] Seq=4757 Ack=151640 Win=221568 Len=0"
"796","6.097741539","206.123.170.175","128.135.24.73","TCP","54","41816  >  443 [ACK] Seq=4757 Ack=154560 Win=227456 Len=0"
"797","6.097750679","206.123.170.175","128.135.24.73","TCP","54","41816  >  443 [ACK] Seq=4757 Ack=157480 Win=233216 Len=0"
"798","6.097777621","128.135.24.73","206.123.170.175","TCP","2974","443  >  41816 [PSH, ACK] Seq=157480 Ack=4628 Win=64128 Len=2920 [TCP segment of a reassembled PDU]"
"799","6.097788648","206.123.170.175","128.135.24.73","TCP","54","41816  >  443 [ACK] Seq=4757 Ack=160400 Win=239104 Len=0"
"801","6.103832630","128.135.24.73","206.123.170.175","TLSv1.2","2974","Application Data"
"802","6.103832881","128.135.24.73","206.123.170.175","TCP","2974","443  >  41816 [PSH, ACK] Seq=163320 Ack=4628 Win=64128 Len=2920 [TCP segment of a reassembled PDU]"
"803","6.103832955","128.135.24.73","206.123.170.175","TCP","2974","443  >  41816 [PSH, ACK] Seq=166240 Ack=4628 Win=64128 Len=2920 [TCP segment of a reassembled PDU]"
"804","6.103833003","128.135.24.73","206.123.170.175","TCP","1514","443  >  41816 [ACK] Seq=169160 Ack=4628 Win=64128 Len=1460 [TCP segment of a reassembled PDU]"
"805","6.103901471","206.123.170.175","128.135.24.73","TCP","54","41816  >  443 [ACK] Seq=4757 Ack=163320 Win=244992 Len=0"
"806","6.103916249","206.123.170.175","128.135.24.73","TCP","54","41816  >  443 [ACK] Seq=4757 Ack=166240 Win=250752 Len=0"
"807","6.103923025","206.123.170.175","128.135.24.73","TCP","54","41816  >  443 [ACK] Seq=4757 Ack=169160 Win=256640 Len=0"
"808","6.103987605","128.135.24.73","206.123.170.175","TCP","1514","443  >  41816 [PSH, ACK] Seq=170620 Ack=4628 Win=64128 Len=1460 [TCP segment of a reassembled PDU]"
"809","6.103987675","128.135.24.73","206.123.170.175","TCP","2974","443  >  41816 [PSH, ACK] Seq=172080 Ack=4628 Win=64128 Len=2920 [TCP segment of a reassembled PDU]"
"810","6.103987739","128.135.24.73","206.123.170.175","TCP","2974","443  >  41816 [PSH, ACK] Seq=175000 Ack=4628 Win=64128 Len=2920 [TCP segment of a reassembled PDU]"
"811","6.103987814","128.135.24.73","206.123.170.175","TLSv1.2","2974","Application Data"
"812","6.103987875","128.135.24.73","206.123.170.175","TCP","2974","443  >  41816 [PSH, ACK] Seq=180840 Ack=4628 Win=64128 Len=2920 [TCP segment of a reassembled PDU]"
"813","6.104005579","206.123.170.175","128.135.24.73","TCP","54","41816  >  443 [ACK] Seq=4757 Ack=172080 Win=262528 Len=0"
"814","6.104013573","206.123.170.175","128.135.24.73","TCP","54","41816  >  443 [ACK] Seq=4757 Ack=175000 Win=268288 Len=0"
"815","6.104021533","206.123.170.175","128.135.24.73","TCP","54","41816  >  443 [ACK] Seq=4757 Ack=177920 Win=274176 Len=0"
"816","6.104028955","206.123.170.175","128.135.24.73","TCP","54","41816  >  443 [ACK] Seq=4757 Ack=180840 Win=279936 Len=0"
"817","6.104039140","206.123.170.175","128.135.24.73","TCP","54","41816  >  443 [ACK] Seq=4757 Ack=183760 Win=285824 Len=0"
"818","6.104060807","128.135.24.73","206.123.170.175","TCP","2974","443  >  41816 [PSH, ACK] Seq=183760 Ack=4628 Win=64128 Len=2920 [TCP segment of a reassembled PDU]"
"819","6.104060886","128.135.24.73","206.123.170.175","TCP","2974","443  >  41816 [PSH, ACK] Seq=186680 Ack=4628 Win=64128 Len=2920 [TCP segment of a reassembled PDU]"
"820","6.104072009","206.123.170.175","128.135.24.73","TCP","54","41816  >  443 [ACK] Seq=4757 Ack=186680 Win=291712 Len=0"
"821","6.104078874","206.123.170.175","128.135.24.73","TCP","54","41816  >  443 [ACK] Seq=4757 Ack=189600 Win=297472 Len=0"
"822","6.104239195","128.135.24.73","206.123.170.175","TCP","2974","443  >  41816 [PSH, ACK] Seq=189600 Ack=4628 Win=64128 Len=2920 [TCP segment of a reassembled PDU]"
"823","6.104239255","128.135.24.73","206.123.170.175","TCP","2974","443  >  41816 [PSH, ACK] Seq=192520 Ack=4628 Win=64128 Len=2920 [TCP segment of a reassembled PDU]"
"824","6.104239335","128.135.24.73","206.123.170.175","TLSv1.2","2974","Application Data"
"825","6.104239413","128.135.24.73","206.123.170.175","TCP","2974","443  >  41816 [PSH, ACK] Seq=198360 Ack=4628 Win=64128 Len=2920 [TCP segment of a reassembled PDU]"
"826","6.104255550","206.123.170.175","128.135.24.73","TCP","54","41816  >  443 [ACK] Seq=4757 Ack=192520 Win=303360 Len=0"
"827","6.104261623","206.123.170.175","128.135.24.73","TCP","54","41816  >  443 [ACK] Seq=4757 Ack=195440 Win=309248 Len=0"
"828","6.104268104","206.123.170.175","128.135.24.73","TCP","54","41816  >  443 [ACK] Seq=4757 Ack=198360 Win=315008 Len=0"
"829","6.104273561","206.123.170.175","128.135.24.73","TCP","54","41816  >  443 [ACK] Seq=4757 Ack=201280 Win=320896 Len=0"
"830","6.104281215","128.135.24.73","206.123.170.175","TCP","2974","443  >  41816 [PSH, ACK] Seq=201280 Ack=4628 Win=64128 Len=2920 [TCP segment of a reassembled PDU]"
"831","6.104281267","128.135.24.73","206.123.170.175","TCP","2974","443  >  41816 [PSH, ACK] Seq=204200 Ack=4628 Win=64128 Len=2920 [TCP segment of a reassembled PDU]"
"832","6.104281324","128.135.24.73","206.123.170.175","TCP","2974","443  >  41816 [PSH, ACK] Seq=207120 Ack=4628 Win=64128 Len=2920 [TCP segment of a reassembled PDU]"
"833","6.104281374","128.135.24.73","206.123.170.175","TLSv1.2","2974","Application Data"
"834","6.104294708","206.123.170.175","128.135.24.73","TCP","54","41816  >  443 [ACK] Seq=4757 Ack=204200 Win=326656 Len=0"
"835","6.104300844","206.123.170.175","128.135.24.73","TCP","54","41816  >  443 [ACK] Seq=4757 Ack=207120 Win=332544 Len=0"
"836","6.104306355","206.123.170.175","128.135.24.73","TCP","54","41816  >  443 [ACK] Seq=4757 Ack=210040 Win=338432 Len=0"
"837","6.104313224","206.123.170.175","128.135.24.73","TCP","54","41816  >  443 [ACK] Seq=4757 Ack=212960 Win=344192 Len=0"
"838","6.104343906","128.135.24.73","206.123.170.175","TCP","2974","443  >  41816 [PSH, ACK] Seq=212960 Ack=4628 Win=64128 Len=2920 [TCP segment of a reassembled PDU]"
"839","6.104343964","128.135.24.73","206.123.170.175","TCP","2974","443  >  41816 [PSH, ACK] Seq=215880 Ack=4628 Win=64128 Len=2920 [TCP segment of a reassembled PDU]"
"840","6.104344035","128.135.24.73","206.123.170.175","TCP","2974","443  >  41816 [PSH, ACK] Seq=218800 Ack=4628 Win=64128 Len=2920 [TCP segment of a reassembled PDU]"
"841","6.104344112","128.135.24.73","206.123.170.175","TLSv1.2","2974","Application Data"
"842","6.104359664","206.123.170.175","128.135.24.73","TCP","54","41816  >  443 [ACK] Seq=4757 Ack=215880 Win=350080 Len=0"
"843","6.104367084","206.123.170.175","128.135.24.73","TCP","54","41816  >  443 [ACK] Seq=4757 Ack=218800 Win=355968 Len=0"
"844","6.104374601","206.123.170.175","128.135.24.73","TCP","54","41816  >  443 [ACK] Seq=4757 Ack=221720 Win=361728 Len=0"
"845","6.104381878","206.123.170.175","128.135.24.73","TCP","54","41816  >  443 [ACK] Seq=4757 Ack=224640 Win=367616 Len=0"
"846","6.104391389","128.135.24.73","206.123.170.175","TCP","2974","443  >  41816 [PSH, ACK] Seq=224640 Ack=4628 Win=64128 Len=2920 [TCP segment of a reassembled PDU]"
"847","6.104391450","128.135.24.73","206.123.170.175","TCP","2974","443  >  41816 [PSH, ACK] Seq=227560 Ack=4628 Win=64128 Len=2920 [TCP segment of a reassembled PDU]"
"848","6.104402388","206.123.170.175","128.135.24.73","TCP","54","41816  >  443 [ACK] Seq=4757 Ack=227560 Win=373376 Len=0"
"849","6.104409350","206.123.170.175","128.135.24.73","TCP","54","41816  >  443 [ACK] Seq=4757 Ack=230480 Win=379264 Len=0"
"850","6.104582177","128.135.24.73","206.123.170.175","TCP","2974","443  >  41816 [PSH, ACK] Seq=230480 Ack=4628 Win=64128 Len=2920 [TCP segment of a reassembled PDU]"
"851","6.104591489","206.123.170.175","128.135.24.73","TCP","54","41816  >  443 [ACK] Seq=4757 Ack=233400 Win=385152 Len=0"
"852","6.105082722","128.135.24.73","206.123.170.175","TCP","2974","443  >  41816 [PSH, ACK] Seq=233400 Ack=4628 Win=64128 Len=2920 [TCP segment of a reassembled PDU]"
"853","6.105082883","128.135.24.73","206.123.170.175","TCP","2974","443  >  41816 [PSH, ACK] Seq=236320 Ack=4628 Win=64128 Len=2920 [TCP segment of a reassembled PDU]"
"854","6.105105147","206.123.170.175","128.135.24.73","TCP","54","41816  >  443 [ACK] Seq=4757 Ack=236320 Win=390912 Len=0"
"855","6.105113215","206.123.170.175","128.135.24.73","TCP","54","41816  >  443 [ACK] Seq=4757 Ack=239240 Win=396800 Len=0"
"856","6.106026245","128.135.24.73","206.123.170.175","TLSv1.2","2974","Application Data"
"857","6.106027182","128.135.24.73","206.123.170.175","TCP","2974","443  >  41816 [PSH, ACK] Seq=242160 Ack=4628 Win=64128 Len=2920 [TCP segment of a reassembled PDU]"
"858","6.106027244","128.135.24.73","206.123.170.175","TCP","2974","443  >  41816 [ACK] Seq=245080 Ack=4628 Win=64128 Len=2920 [TCP segment of a reassembled PDU]"
"859","6.106063668","206.123.170.175","128.135.24.73","TCP","54","41816  >  443 [ACK] Seq=4757 Ack=242160 Win=402688 Len=0"
"860","6.106072850","206.123.170.175","128.135.24.73","TCP","54","41816  >  443 [ACK] Seq=4757 Ack=245080 Win=408448 Len=0"
"861","6.106079560","206.123.170.175","128.135.24.73","TCP","54","41816  >  443 [ACK] Seq=4757 Ack=248000 Win=414336 Len=0"
"862","6.106109155","128.135.24.73","206.123.170.175","TCP","1514","443  >  41816 [PSH, ACK] Seq=248000 Ack=4628 Win=64128 Len=1460 [TCP segment of a reassembled PDU]"
"863","6.106109207","128.135.24.73","206.123.170.175","TCP","4434","443  >  41816 [PSH, ACK] Seq=249460 Ack=4628 Win=64128 Len=4380 [TCP segment of a reassembled PDU]"
"864","6.106109271","128.135.24.73","206.123.170.175","TLSv1.2","2974","Application Data"
"865","6.106127194","206.123.170.175","128.135.24.73","TCP","54","41816  >  443 [ACK] Seq=4757 Ack=253840 Win=425984 Len=0"
"866","6.106134042","206.123.170.175","128.135.24.73","TCP","54","41816  >  443 [ACK] Seq=4757 Ack=256760 Win=431872 Len=0"
"867","6.106147623","128.135.24.73","206.123.170.175","TCP","1514","443  >  41816 [PSH, ACK] Seq=256760 Ack=4628 Win=64128 Len=1460 [TCP segment of a reassembled PDU]"
"868","6.106147671","128.135.24.73","206.123.170.175","TCP","4434","443  >  41816 [PSH, ACK] Seq=258220 Ack=4628 Win=64128 Len=4380 [TCP segment of a reassembled PDU]"
"869","6.106159173","206.123.170.175","128.135.24.73","TCP","54","41816  >  443 [ACK] Seq=4757 Ack=262600 Win=443520 Len=0"
"870","6.106197435","128.135.24.73","206.123.170.175","TCP","4434","443  >  41816 [PSH, ACK] Seq=262600 Ack=4628 Win=64128 Len=4380 [TCP segment of a reassembled PDU]"
"871","6.106197485","128.135.24.73","206.123.170.175","TCP","1514","443  >  41816 [ACK] Seq=266980 Ack=4628 Win=64128 Len=1460 [TCP segment of a reassembled PDU]"
"872","6.106206768","206.123.170.175","128.135.24.73","TCP","54","41816  >  443 [ACK] Seq=4757 Ack=266980 Win=452224 Len=0"
"873","6.106249218","128.135.24.73","206.123.170.175","TCP","2974","443  >  41816 [PSH, ACK] Seq=268440 Ack=4628 Win=64128 Len=2920 [TCP segment of a reassembled PDU]"
"874","6.106249266","128.135.24.73","206.123.170.175","TLSv1.2","2974","Application Data"
"875","6.106258075","206.123.170.175","128.135.24.73","TCP","54","41816  >  443 [ACK] Seq=4757 Ack=271360 Win=461056 Len=0"
"876","6.106262403","206.123.170.175","128.135.24.73","TCP","54","41816  >  443 [ACK] Seq=4757 Ack=274280 Win=466816 Len=0"
"877","6.106376066","128.135.24.73","206.123.170.175","TCP","4434","443  >  41816 [PSH, ACK] Seq=274280 Ack=4628 Win=64128 Len=4380 [TCP segment of a reassembled PDU]"
"878","6.106384007","206.123.170.175","128.135.24.73","TCP","54","41816  >  443 [ACK] Seq=4757 Ack=278660 Win=475648 Len=0"
"879","6.107265816","128.135.24.73","206.123.170.175","TCP","4434","443  >  41816 [PSH, ACK] Seq=278660 Ack=4628 Win=64128 Len=4380 [TCP segment of a reassembled PDU]"
"880","6.107265876","128.135.24.73","206.123.170.175","TCP","2974","443  >  41816 [ACK] Seq=283040 Ack=4628 Win=64128 Len=2920 [TCP segment of a reassembled PDU]"
"881","6.107298329","206.123.170.175","128.135.24.73","TCP","54","41816  >  443 [ACK] Seq=4757 Ack=283040 Win=484352 Len=0"
"882","6.107307651","206.123.170.175","128.135.24.73","TCP","54","41816  >  443 [ACK] Seq=4757 Ack=285960 Win=490240 Len=0"
"883","6.107379043","128.135.24.73","206.123.170.175","TCP","1514","443  >  41816 [PSH, ACK] Seq=285960 Ack=4628 Win=64128 Len=1460 [TCP segment of a reassembled PDU]"
"884","6.110333472","128.135.24.73","206.123.170.175","TLSv1.2","4434","Application Data, Application Data"
"885","6.110333742","128.135.24.73","206.123.170.175","TCP","2974","443  >  41816 [ACK] Seq=291800 Ack=4628 Win=64128 Len=2920 [TCP segment of a reassembled PDU]"
"886","6.110382971","206.123.170.175","128.135.24.73","TCP","54","41816  >  443 [ACK] Seq=4757 Ack=291800 Win=501888 Len=0"
"887","6.110395343","206.123.170.175","128.135.24.73","TCP","54","41816  >  443 [ACK] Seq=4757 Ack=294720 Win=507776 Len=0"
"888","6.110476647","128.135.24.73","206.123.170.175","TCP","1514","443  >  41816 [PSH, ACK] Seq=294720 Ack=4628 Win=64128 Len=1460 [TCP segment of a reassembled PDU]"
"889","6.110476734","128.135.24.73","206.123.170.175","TCP","4434","443  >  41816 [PSH, ACK] Seq=296180 Ack=4628 Win=64128 Len=4380 [TCP segment of a reassembled PDU]"
"890","6.110476814","128.135.24.73","206.123.170.175","TCP","1514","443  >  41816 [ACK] Seq=300560 Ack=4628 Win=64128 Len=1460 [TCP segment of a reassembled PDU]"
"891","6.110496253","206.123.170.175","128.135.24.73","TCP","54","41816  >  443 [ACK] Seq=4757 Ack=300560 Win=519424 Len=0"
"892","6.110571841","128.135.24.73","206.123.170.175","TCP","2974","443  >  41816 [PSH, ACK] Seq=302020 Ack=4628 Win=64128 Len=2920 [TCP segment of a reassembled PDU]"
"893","6.110580909","206.123.170.175","128.135.24.73","TCP","54","41816  >  443 [ACK] Seq=4757 Ack=304940 Win=528256 Len=0"
"894","6.111138625","206.123.170.175","128.135.24.73","TLSv1.2","177","Application Data"
"895","6.157189125","128.135.24.73","206.123.170.175","TLSv1.2","1514","Application Data"
"896","6.157189635","128.135.24.73","206.123.170.175","TCP","4434","443  >  41816 [PSH, ACK] Seq=306400 Ack=4757 Win=64128 Len=4380 [TCP segment of a reassembled PDU]"
"897","6.157189723","128.135.24.73","206.123.170.175","TCP","2974","443  >  41816 [ACK] Seq=310780 Ack=4757 Win=64128 Len=2920 [TCP segment of a reassembled PDU]"
"898","6.157282312","206.123.170.175","128.135.24.73","TCP","54","41816  >  443 [ACK] Seq=4880 Ack=310780 Win=539904 Len=0"
"899","6.157293410","206.123.170.175","128.135.24.73","TCP","54","41816  >  443 [ACK] Seq=4880 Ack=313700 Win=545664 Len=0"
"900","6.157311763","128.135.24.73","206.123.170.175","TCP","1514","443  >  41816 [PSH, ACK] Seq=313700 Ack=4757 Win=64128 Len=1460 [TCP segment of a reassembled PDU]"
"901","6.157311821","128.135.24.73","206.123.170.175","TCP","4434","443  >  41816 [PSH, ACK] Seq=315160 Ack=4757 Win=64128 Len=4380 [TCP segment of a reassembled PDU]"
"902","6.157311879","128.135.24.73","206.123.170.175","TLSv1.2","4434","Application Data"
"903","6.157311931","128.135.24.73","206.123.170.175","TCP","4434","443  >  41816 [PSH, ACK] Seq=323920 Ack=4757 Win=64128 Len=4380 [TCP segment of a reassembled PDU]"
"904","6.157339029","128.135.24.73","206.123.170.175","TCP","2974","443  >  41816 [ACK] Seq=328300 Ack=4757 Win=64128 Len=2920 [TCP segment of a reassembled PDU]"
"905","6.157362990","206.123.170.175","128.135.24.73","TCP","54","41816  >  443 [ACK] Seq=4880 Ack=328300 Win=574976 Len=0"
"906","6.157365468","128.135.24.73","206.123.170.175","TCP","1514","443  >  41816 [PSH, ACK] Seq=331220 Ack=4757 Win=64128 Len=1460 [TCP segment of a reassembled PDU]"
"907","6.157365526","128.135.24.73","206.123.170.175","TCP","4434","443  >  41816 [PSH, ACK] Seq=332680 Ack=4757 Win=64128 Len=4380 [TCP segment of a reassembled PDU]"
"908","6.157381489","206.123.170.175","128.135.24.73","TCP","54","41816  >  443 [ACK] Seq=4880 Ack=332680 Win=583680 Len=0"
"909","6.157388609","206.123.170.175","128.135.24.73","TCP","54","41816  >  443 [ACK] Seq=4880 Ack=337060 Win=592384 Len=0"
"910","6.163283713","128.135.24.73","206.123.170.175","TLSv1.2","7354","Application Data"
"911","6.163337749","206.123.170.175","128.135.24.73","TCP","54","41816  >  443 [ACK] Seq=4880 Ack=344360 Win=606976 Len=0"
"912","6.163542342","128.135.24.73","206.123.170.175","TCP","5894","443  >  41816 [PSH, ACK] Seq=344360 Ack=4757 Win=64128 Len=5840 [TCP segment of a reassembled PDU]"
"913","6.163542445","128.135.24.73","206.123.170.175","TLSv1.2","5894","Application Data, Application Data"
"914","6.163572531","206.123.170.175","128.135.24.73","TCP","54","41816  >  443 [ACK] Seq=4880 Ack=350200 Win=618752 Len=0"
"915","6.163583680","206.123.170.175","128.135.24.73","TCP","54","41816  >  443 [ACK] Seq=4880 Ack=356040 Win=630400 Len=0"
"916","6.163591909","128.135.24.73","206.123.170.175","TCP","5894","443  >  41816 [PSH, ACK] Seq=356040 Ack=4757 Win=64128 Len=5840 [TCP segment of a reassembled PDU]"
"917","6.163591976","128.135.24.73","206.123.170.175","TCP","5894","443  >  41816 [PSH, ACK] Seq=361880 Ack=4757 Win=64128 Len=5840 [TCP segment of a reassembled PDU]"
"918","6.163603331","206.123.170.175","128.135.24.73","TCP","54","41816  >  443 [ACK] Seq=4880 Ack=361880 Win=642048 Len=0"
"919","6.163610291","206.123.170.175","128.135.24.73","TCP","54","41816  >  443 [ACK] Seq=4880 Ack=367720 Win=653696 Len=0"
"920","6.163643160","128.135.24.73","206.123.170.175","TCP","2974","443  >  41816 [PSH, ACK] Seq=367720 Ack=4757 Win=64128 Len=2920 [TCP segment of a reassembled PDU]"
"921","6.163643229","128.135.24.73","206.123.170.175","TLSv1.2","5894","Application Data"
"922","6.163643332","128.135.24.73","206.123.170.175","TCP","5894","443  >  41816 [PSH, ACK] Seq=376480 Ack=4757 Win=64128 Len=5840 [TCP segment of a reassembled PDU]"
"923","6.163658984","206.123.170.175","128.135.24.73","TCP","54","41816  >  443 [ACK] Seq=4880 Ack=370640 Win=659584 Len=0"
"924","6.163667020","206.123.170.175","128.135.24.73","TCP","54","41816  >  443 [ACK] Seq=4880 Ack=376480 Win=671232 Len=0"
"925","6.163684831","128.135.24.73","206.123.170.175","TLSv1.2","5894","Application Data"
"926","6.163696803","206.123.170.175","128.135.24.73","TCP","54","41816  >  443 [ACK] Seq=4880 Ack=382320 Win=683008 Len=0"
"927","6.163709036","206.123.170.175","128.135.24.73","TCP","54","41816  >  443 [ACK] Seq=4880 Ack=388160 Win=694656 Len=0"
"928","6.163814747","128.135.24.73","206.123.170.175","TCP","5894","443  >  41816 [PSH, ACK] Seq=388160 Ack=4757 Win=64128 Len=5840 [TCP segment of a reassembled PDU]"
"929","6.163814793","128.135.24.73","206.123.170.175","TCP","5894","443  >  41816 [PSH, ACK] Seq=394000 Ack=4757 Win=64128 Len=5840 [TCP segment of a reassembled PDU]"
"930","6.163828919","206.123.170.175","128.135.24.73","TCP","54","41816  >  443 [ACK] Seq=4880 Ack=394000 Win=706304 Len=0"
"931","6.163835664","206.123.170.175","128.135.24.73","TCP","54","41816  >  443 [ACK] Seq=4880 Ack=399840 Win=717952 Len=0"
"932","6.163851264","128.135.24.73","206.123.170.175","TCP","2974","443  >  41816 [PSH, ACK] Seq=399840 Ack=4757 Win=64128 Len=2920 [TCP segment of a reassembled PDU]"
"933","6.163851347","128.135.24.73","206.123.170.175","TLSv1.2","5894","Application Data"
"934","6.163851426","128.135.24.73","206.123.170.175","TCP","1514","443  >  41816 [ACK] Seq=408600 Ack=4757 Win=64128 Len=1460 [TCP segment of a reassembled PDU]"
"935","6.163864223","206.123.170.175","128.135.24.73","TCP","54","41816  >  443 [ACK] Seq=4880 Ack=402760 Win=723840 Len=0"
"936","6.163870693","206.123.170.175","128.135.24.73","TCP","54","41816  >  443 [ACK] Seq=4880 Ack=408600 Win=735488 Len=0"
"937","6.164062280","128.135.24.73","206.123.170.175","TCP","4434","443  >  41816 [PSH, ACK] Seq=410060 Ack=4757 Win=64128 Len=4380 [TCP segment of a reassembled PDU]"
"938","6.164062336","128.135.24.73","206.123.170.175","TLSv1.2","7354","Application Data, Application Data"
"939","6.164078613","206.123.170.175","128.135.24.73","TCP","54","41816  >  443 [ACK] Seq=4880 Ack=414440 Win=747136 Len=0"
"940","6.164085875","206.123.170.175","128.135.24.73","TCP","54","41816  >  443 [ACK] Seq=4880 Ack=421740 Win=761856 Len=0"
"941","6.164112097","128.135.24.73","206.123.170.175","TCP","7354","443  >  41816 [PSH, ACK] Seq=421740 Ack=4757 Win=64128 Len=7300 [TCP segment of a reassembled PDU]"
"942","6.164112142","128.135.24.73","206.123.170.175","TCP","5894","443  >  41816 [PSH, ACK] Seq=429040 Ack=4757 Win=64128 Len=5840 [TCP segment of a reassembled PDU]"
"943","6.164123772","206.123.170.175","128.135.24.73","TCP","54","41816  >  443 [ACK] Seq=4880 Ack=429040 Win=776448 Len=0"
"944","6.164129434","206.123.170.175","128.135.24.73","TCP","54","41816  >  443 [ACK] Seq=4880 Ack=434880 Win=788096 Len=0"
"945","6.164142120","128.135.24.73","206.123.170.175","TLSv1.2","7354","Application Data"
"946","6.164142203","128.135.24.73","206.123.170.175","TCP","4434","443  >  41816 [ACK] Seq=442180 Ack=4757 Win=64128 Len=4380 [TCP segment of a reassembled PDU]"
"947","6.164152716","206.123.170.175","128.135.24.73","TCP","54","41816  >  443 [ACK] Seq=4880 Ack=442180 Win=802688 Len=0"
"948","6.164158737","206.123.170.175","128.135.24.73","TCP","54","41816  >  443 [ACK] Seq=4880 Ack=446560 Win=811392 Len=0"
"949","6.164323207","128.135.24.73","206.123.170.175","TCP","2974","443  >  41816 [PSH, ACK] Seq=446560 Ack=4757 Win=64128 Len=2920 [TCP segment of a reassembled PDU]"
"950","6.164323316","128.135.24.73","206.123.170.175","TLSv1.2","7354","Application Data"
"951","6.164323400","128.135.24.73","206.123.170.175","TCP","7354","443  >  41816 [PSH, ACK] Seq=456780 Ack=4757 Win=64128 Len=7300 [TCP segment of a reassembled PDU]"
"952","6.164344931","206.123.170.175","128.135.24.73","TCP","54","41816  >  443 [ACK] Seq=4880 Ack=449480 Win=817280 Len=0"
"953","6.164352669","206.123.170.175","128.135.24.73","TCP","54","41816  >  443 [ACK] Seq=4880 Ack=456780 Win=831872 Len=0"
"954","6.164359376","206.123.170.175","128.135.24.73","TCP","54","41816  >  443 [ACK] Seq=4880 Ack=464080 Win=846464 Len=0"
